location,totaltweets,retweetcount,hashtags,date,Clean Text,Sentiment
Earth,222148,2,"['klimakrisen', 'corona', 'klima', 'dkpol', 'dkmedier', 'dkgreen']",2021-08-12 20:01:40,jeg ved godt det bliver sagt ofte  men det kan ikke blive sagt ofte nok  lad os nu give  samme fokus på       ,3.0
1787 Kbh V,14430,5,"['dkbiz', 'dkforsvar', 'dkpol']",2021-08-12 20:01:15,medlem af   fik besøg af   ministeren ønsker tættere samarbejde med  mere i  med bl a      ,4.0
København,3352,0,"['dkpol', 'dkmedier']",2021-08-12 20:00:21, den eneste man ikke gider have en kommentar fra  når man blæser rundt i det politiske stormvejr     ,2.0
Denmark,141,1,['dkpol'],2021-08-12 20:00:05,hvorfor fortsætter heegaard ikke bare i    ,0.0
,4715,0,['dkpol'],2021-08-12 19:59:54,er begrundelsen virkeligt  at  det er spild af penge   når flygtninge fra afganistan ikke skal sendes hjem    hvad er der sket med menneskesynet i       ,1.0
"København, Hovedstaden",4987,4,['dkpol'],2021-08-12 19:59:17,dette er en helt igennem uhyggelig sag   og  fortsætter afdækningen af pfosforureningen i korsør  borgere  har store mængder gift i kroppen     ,-4.0
,22465,0,['dkpol'],2021-08-12 19:57:08,   et tab for de radikale måske  for  nej  han vil ikke være savnet ,-6.0
,417,15,"['dkpol', 'kontanter']",2021-08-12 19:54:47,danmark siger klart nej til kontantløst samfund     procent af danskerne vil bevare kontanter og ønsker ikke et såkaldt kontantløst samfund  og så vil vi have mulighed for at trække vores penge ud af bankerne – i kontanter     ,3.0
1787 Kbh V,14430,3,['dkpol'],2021-08-12 19:54:47,på besøg hos forsvarsvirksomheden ; en virksomhed ud af mange  der er med til at spille en afgørende rolle for danmarks forsvar og sikkerhed  glædeligt at regeringen viser så stor forståelse for betydningen af den danske forsvarsindustri   ,5.0
"Lystrup, Danmark",5730,7,['dkpol'],2021-08-12 19:54:18,det er genialt det her  først fester vi halv og helgamle for fulde gardiner  og når så regningen skal betales  sender vi den til de unge arbejdsløse   ,4.0
"Frederiksberg, Danmark",1410,2,"['dkpol', 'dkforsvar', 'ProudToBeAWeibel']",2021-08-12 19:53:44,så ranker man lige ryggen og spænder hjelmen to hakker ind  når ⁦⁩ og ⁦⁩ fra ⁦⁩ lancerer ny forsvarsindustriel strategi på ens arbejdsplads     ,1.0
Espergærde - Snoghøj ,26978,0,['dkpol'],2021-08-12 19:53:08,alkohol ud af ,0.0
"Dragør, Danmark",7803,13,"['stopdet', 'dkpol', 'dkmedier', 'sundpol', 'Covid19dk', 'coronadk', 'COVID19']",2021-08-12 19:52:47,   no surprise   se opsummering i tweet herunder af den kendte viden om ekspressionen af ace  i forskellige organer   nyrerne er et af organsystemerne med høj ekspression          ,0.0
,13128,0,"['dkmedier', 'dkpol', 'sygtankegang', 'blivnuvoksen']",2021-08-12 19:51:43,     husstande i holstebro risikere oversvømmelser fordi nogle fra danmarks naturfredningsforening vil beskytte en plante  milliarder vs en fredet plante       ,-1.0
"Vejle, Denmark",172,0,"['dkpol', 'dkgreen']",2021-08-12 19:51:29,grundvandsparkerne er samtidig et rigtig godt udgangspunkt for at skabe bedre og mere sammenhængende naturområder    ,5.0
Copenhagen,2610,4,"['dkpol', 'COIN', 'Afghanistan', 'NytVietnam']",2021-08-12 19:51:01,som dreng så jeg disse billeder med frygt  nu gentager de sig måske  usa der er født af et oprør  har ikke selv udviklet en holdbar strategi og doktrin til oprørsbekæmpelse       ,-4.0
København,1801,0,"['dkpol', 'dkmedier']",2021-08-12 19:49:42,hvorfor sygemelder  sig ikke  ligesom  og naser khader gjorde  det kan vel kun være fordi  han ved  at mette frederiksen snart trykke på valgknappen    ,0.0
Denmark DK Europe Earth Heart,98604,1,['dkpol'],2021-08-12 19:48:59,det blev så ssi og sst understøttet af diverse eksperter  der klarede det for regeringen  ,-2.0
Danmark,5098,18,"['stopdet', 'dkpol', 'dkmedier', 'sundpol', 'Covid19dk', 'coronadk', 'COVID19']",2021-08-12 19:48:54,   snart må vi vel forvente at regeringens sundhedseksperter og regeringen får den idé at lukke landet ned og indføre de andre meningsløse restriktioner når der er pollen i luften         ,-1.0
"København, Danmark",13218,28,['dkpol'],2021-08-12 19:46:43,vi frygter  at tolkenes ophold ikke bliver midlertidigt  det gør tolkene nok også  eftersom det ville betyde  at de aldrig igen ville være sikre i deres eget hjemland  men fortæl mig om dit problem igen  ,-3.0
,49,1,"['dkpol', 'dkbiz', 'dkforsvar']",2021-08-12 19:46:17,breaking news  ny forsvarsindustriel strategi præsenteres imorgen af ⁦⁩ og ⁦⁩    ,0.0
Denmark,384,0,['dkpol'],2021-08-12 19:46:14,  er i en styrelse for sundhed eller en flok aktivister der laver politiske kampagner for skattemidler  hvorfor flager i med regnbueflag  ,0.0
,94,4,['dkpol'],2021-08-12 19:46:05,ros til  for at fremsende datoer til kommende forhandlingsforløb om nye nationale test  i god tid og med en hel møderække  som alle sammen ligger på fornuftige tidspunkter  det kunne mange ministre lære noget af  og det burde være en selvfølge ,6.0
"Syddanmark, Danmark",1710,1,"['CoronaDK', 'FrihedDK', 'dkpol']",2021-08-12 19:46:04, message til alle jer coronapanikere derude  ssi siger nu hvad vi andre har sagt hele tiden  tag din vaccine og slap helt af    kunne være fedt hvis panik folkene derude kunne tage en slapper    ,-3.0
Earth,222148,8,"['dkpol', 'dkgreen']",2021-08-12 19:45:53,farlig dikotomi af klima og offentlig forbrug    i stedet for at forurenerne betaler for deres forurening  foreslår man at en lille gruppe betaler for subsidier til forurenerne  og skaber splid i samfundet   uanstændigt       ,-10.0
,1144,0,"['metoo', 'dkpol']",2021-08-12 19:44:58,  er pressemøde om    ,0.0
"Hovedstaden, Danmark",15545,3,['dkpol'],2021-08-12 19:44:33,på besøg hos forsvarsvirksomheden ; en virksomhed ud af mange  der er med til at spille en afgørende rolle for danmarks forsvar og sikkerhed  glædeligt at regeringen viser så stor forståelse for betydningen af den danske forsvarsindustri   ,5.0
Syddanmark,344459,1,"['dkmedier', 'dkpol']",2021-08-12 19:44:20,du har instagram  pernille vermund har berlingske   ,0.0
"København, Hovedstaden",6479,1,['dkpol'],2021-08-12 19:43:57,sagen er et godt eksempel på  hvorfor man skal have whistleblower ordninger  så sager kommer til kendskab for dem  der har mulighed for at handle og drage de konsekvenser man mener er rigtige   ,5.0
,5408,1,"['dkmedier', 'dkpol']",2021-08-12 19:43:29,du har instagram  pernille vermund har berlingske   ,0.0
,7280,0,"['skarplud', 'dkpol', 'dkmedier']",2021-08-12 19:43:29,hvilke andre steder end i folketinget får man respekt for at gå selv når man har krænket et andet menneske  du har taget på din kvindelige kokkeelev ude på tørlageret  fedt at du tager konsekvensen og smutter nej vel  det hedder   ud  klamme svin   ,-3.0
"Vancouver, Canada",1683,7,"['dkbiz', 'dkpol']",2021-08-12 19:42:29,godt med en ny strategi for dansk forsvarsindustri   og    vurderer i  at den nye strategi vil få positiv betydning for  mulighed for at afsætte deres produkter i udlandet   ,9.0
,11381,0,['dkpol'],2021-08-12 19:41:40, jeg har også ondt af ham faktisk   ikke fedt  hvis han er sygt klam og drikker til han blackouter  men er der ingen i det parti  der støtter hinanden  når man når derud  det gør normale mennesker da  vi fragter vennen hjem ppå det tidspunkt  så de ikke når at krænke nogen  ,-4.0
København,11841,0,['dkpol'],2021-08-12 19:40:32,til kommunalvalget i københavn stemmer jeg på den kandidat hvis eneste mærkesag er  at få stoppet de fly indover byen  partiet er underordnet ,-1.0
"København, Danmark",4803,28,['dkpol'],2021-08-12 19:40:18,vi frygter  at tolkenes ophold ikke bliver midlertidigt  det gør tolkene nok også  eftersom det ville betyde  at de aldrig igen ville være sikre i deres eget hjemland  men fortæl mig om dit problem igen  ,-3.0
Danmark,72723,4,"['dkpol', 'dkmedier']",2021-08-12 19:40:01,altså undskyld mig  det er jo fantastisk smukke og stilfulde fotos  blandingen af det bornerte og misundelighed er til gengæld klamt  high five fra den kristelige her      ,3.0
,2591,0,['dkpol'],2021-08-12 19:39:33,gæt et land      ,0.0
"Hovedstaden, Danmark",15545,3,"['dkbiz', 'dkpol']",2021-08-12 19:39:05,   erhvervsskoler landet over fortæller de ikke kan følge med efterspørgslen på lærlinge til især byggebranchen   konsekvensen er at  må takke nej til ordrer – det kan bidrage til at bremse det opsving vi alle ønsker os   læs historien her     ,3.0
Danmark,1301,4,"['dkpol', 'dkmedier']",2021-08-12 19:38:55,altså undskyld mig  det er jo fantastisk smukke og stilfulde fotos  blandingen af det bornerte og misundelighed er til gengæld klamt  high five fra den kristelige her      ,3.0
"The Vejle, Jutland, Denmark",22365,1,['dkpol'],2021-08-12 19:38:39,måske vi skulle tage en snak om alkohol i  og i danmark i almindelighed   tænker det må være det  som har fået kæden til  at hoppe af  endnu engang     ,0.0
"Assens, Syddanmark",483,3,"['dkpol', 'dkgreen', 'energiøer']",2021-08-12 19:38:20, har tildelt opgaven med at udføre miljøundersøgelser af energiøerne til niras og      øer,3.0
"Midtjylland, Danmark",192,32,"['dkforsvar', 'dkpol']",2021-08-12 19:37:33,aftale om hjælp til lokalansatte afghanere hjælper ingen af de tolke  der gik patruljer i helmand med dannebrog på skulderen  usselt og uværdigt  siger veteraner        ,0.0
Copenhagen,71,0,"['dkpol', 'dkmedier']",2021-08-12 19:37:16,er enig med   at fx klummen  her i   udtrykker et forældet kvinde og måske vigtigere  kropssyn   synes krop er ok i politik  og alle andre steder     ,1.0
"Copenhagen, Denmark",992,82,['dkpol'],2021-08-20 23:58:51, mir  var    år  jeg var     og det var mit ansvar at passe på ham når vi gik patruljer og når vi var i kamp  han havde ikke noget våben  så aftalen var  at han skulle blive lige bagved mig når kuglerne fløj   jeg kan ikke udtrykke hvor frustrerende og skamfuldt jeg har det ,1.0
Denmark,3079,14,"['dkpol', 'dkmedier', 'DeterBareMaver']",2021-08-20 23:54:12,debatten om croptop er vigtig af den simple årsag  at vi bliver nødt til at sige klart  drenges/mænds tanker og handlinger er ikke pigers/kvinders ansvar  i det hele taget er vi alle ansvarlige for egne handlinger    ,1.0
"Burnaby, British Columbia",916,13,['dkpol'],2021-08-20 23:30:00,jeg er glad for at kunne bekræfte  at vi nu har fået et fly med    evakuerede personer på sikker grund i danmark    operationen er stadig i fuld gang  og vi arbejder på højtryk for at evakuere de sidste lokalansatte  tolke og andre grupper ud af kabul  ,6.0
"Et sted, hvor der er læ......©",11633,0,['dkpol'],2021-08-20 23:27:34,   alle lokalt ansatte er evakueret fra afghanistan  see more ,0.0
"Aalborg, Danmark",13658,9,"['DKpol', 'FlygtningeErVelkommenIMitDanmark']",2021-08-20 23:06:10,mit gæt er at der er omkring     flygtningehadere i dette land   derfor er det alle vores andre forbandede pligt at fortælle  at vi byder flygtninge velkommen  og mange af os tror de vil være et aktiv for vores samfund   ,4.0
København,231500,4,['dkpol'],2021-08-20 23:00:58,det er flot når man formentlig ikke kan regne  det er estimeret pris for asylansøgere i et helt år  kvoteflygtninge er jo screenet ved ankomst  så alene den præmis er forkert  med mindre han taler om en halv milliard nationalistiske hovedbrud for en socialdemokrat   ,0.0
"Svendborg, Danmark",2835,1,['dkpol'],2021-08-20 22:58:22,får ondt i maven over de billeder fra kabul  vi tillod at det endte her  hvordan kan vi nogensinde overbevise nogen om vores gode intentioner fremover  vi sendte stadig flygtninge retur til afghanistan frem til slut juli  det har ikke kostet nogle hoveder på borgen endnu  ,-1.0
London ,4516,9,"['dkpol', 'dkgreen']",2021-08-20 22:56:21,vi skal skabe en verden drevet af grøn energi  og vi har travlt   har et klart budskab i   det er ikke nok at gøre ’noget’  det handler om at gøre nok og at gøre det i en fart  så vi undgår klimaets ’highway to hell’   ,0.0
Danmark,323459,5,"['COVID19', 'dkpol']",2021-08-20 22:54:03,tak  for et kæmpe  ofte utaknemligt  slid igennem historisk vanskellige tider  tak for din medvirken til at få bl a   fuldtallige igennem  krisen  med utallige orienteringer  lydhørhed &amp; hjerte    ,0.0
,6857,5,"['COVID19', 'dkpol']",2021-08-20 22:53:39,tak  for et kæmpe  ofte utaknemligt  slid igennem historisk vanskellige tider  tak for din medvirken til at få bl a   fuldtallige igennem  krisen  med utallige orienteringer  lydhørhed &amp; hjerte    ,0.0
"Gladsaxe, Danmark",41249,9,"['DKpol', 'FlygtningeErVelkommenIMitDanmark']",2021-08-20 22:48:34,mit gæt er at der er omkring     flygtningehadere i dette land   derfor er det alle vores andre forbandede pligt at fortælle  at vi byder flygtninge velkommen  og mange af os tror de vil være et aktiv for vores samfund   ,4.0
København,231500,11,"['dkpol', 'dkmedier']",2021-08-20 22:45:09,ambassadøren flygtede mod sin vilje ud af kabul søndag  samme dag som  talte om sæler på ærø     ,0.0
"København, Danmark",25040,51,['dkpol'],2021-08-20 22:44:22,danmark tvangsudsendte i juli udlændinge til afghanistan  mens taliban stormede frem   det oplyser myndighederne til ⁦⁩    tvangsudsendelse vil sige  at folk mod deres vilje og evt  med magt blev fløjet til afghanistan      ,2.0
,342,25,"['stopdet', 'dkpol', 'dkmedier', 'sundpol', 'Covid19dk', 'coronadk', 'COVID19']",2021-08-20 22:43:47,det taler for sig selv         ,0.0
Denmark,42491,51,['dkpol'],2021-08-20 22:43:15,danmark tvangsudsendte i juli udlændinge til afghanistan  mens taliban stormede frem   det oplyser myndighederne til ⁦⁩    tvangsudsendelse vil sige  at folk mod deres vilje og evt  med magt blev fløjet til afghanistan      ,2.0
"Denmark, Copenhagen",48248,15,['dkpol'],2021-08-20 22:35:51,mangler du lidt weekendlæsning  så tjek  grafikker og se  hvem der har været tilmeldt møderne i  erhvervsklub  og hvordan netværket er forbundet  det er the usual suspects i den danske magtelite  siger      ,-2.0
København,231500,11,"['dkpol', 'dyrevelfærd', 'dkfood']",2021-08-20 22:35:14,    millioner døde pattegrise i de danske stalde sidste år  det er en skandale   landbruget har fået alle chancer for at komme problemet til livs  men tallet er blot steget  nu må der politisk handling til fra  og   ærd  ,-4.0
København,231500,11,"['dkpol', 'dkgreen']",2021-08-20 22:33:59,utroligt hvis det her kommer som en overraskelse   det er en helt igennem ufornuftig business strategi  at vi i danmark skal producere kød  der kan konkurrere på pris i kina  og det har store omkostninger for dks miljø og natur    ,-1.0
København,231500,1,"['dkpol', 'kulturpolitik']",2021-08-20 22:32:07,så er  s bog  finkultur og mangfoldighed     års dansk kulturpolitik  kommet fra trykkeriet  vi glæder os til udgivelsen    september   ,3.0
København,231500,9,"['dkpol', 'dkmedier', 'Afghanishtan', 'Kabul']",2021-08-20 22:30:42,til danske journalister  når politikere og andre påstår at civilbefolkningen er glade for taliban      ,4.0
Danmark,2330,10,['dkpol'],2021-08-20 22:30:39,er vi     ’ernes ddr  tænk at  har så lidt respekt for menneskers selvbestemmelse  private på velfærdsområdet findes kun fordi borgerne har valgt dem til og fordi de leverer kvalitet   ,2.0
"Frederiksberg, Denmark",45025,0,"['COVID19', 'dkpol', 'dkmedier']",2021-08-20 22:30:35,shoutout til et af mine forbilleder   er den bedste til  at formidle om  og min go to kilde  når jeg har brug at blive opdateret på hvor vi er henne  hun formår  at levere sagligt  konkret  uden omsvøb og uden embedsmandsretorik    ,8.0
København,231500,51,['dkpol'],2021-08-20 22:29:48,danmark tvangsudsendte i juli udlændinge til afghanistan  mens taliban stormede frem   det oplyser myndighederne til ⁦⁩    tvangsudsendelse vil sige  at folk mod deres vilje og evt  med magt blev fløjet til afghanistan      ,2.0
København,231500,9,"['dkpol', 'dyrevelfærd', 'dkfood']",2021-08-20 22:28:44,frygten var at svinehandlingsplanen blev en syltekrukke  desværre blev det en realitet  vi kan ikke være det bekendt   ærd  ,-4.0
,25142,0,['dkpol'],2021-08-20 22:28:04,mener ikke det er så længe siden at vesten som helhed var temmeligt enige om at vi forhandler ikke med terrorister  nu kan jeg så forstå  at det kommer vi nok til at gøre    / ,1.0
"Skanderborg, Danmark",93,1,"['dkpol', 'radio4dk']",2021-08-20 22:16:01,enhedslisten  vi bør tage imod      afghanske flygtninge  det siger  til radio  morgen   lyt med her      ,-1.0
"Capital Region, Denmark",1789,2,"['3', 'dkpol']",2021-08-20 22:15:46,mest læste seneste døgn   der er over de sidste    år blevet importeret utroligt mange våben til landet  som kan udgøre ingredienserne til en meget voldsom borgerkrig  interview med  [for abonnenter]    ,-2.0
"Kalundborg, Danmark",18822,4,['dkpol'],2021-08-20 22:15:44,  biden har med overlæg skabt en katastrofe ingen kender fuld konsekvens af sikkerhed i europa er også i fare  &amp; skaber utryghed  der er tusindvis af islamist tilhængere i eu der hver fredag kalder til bøn på arabisk   hvornår siger ftpolitikere stop ,-2.0
Køge kommune,3776,1,"['dkpol', 'WorldPride']",2021-08-20 22:02:01,i      fik danmark en ny regering og et nyt politisk flertal  nyt flertal skal betyde ny retning  nu foreslår ligestillingsminister      og  at styrke barselsmulighederne for regnbuefamilier      ,4.0
Køge kommune,3776,4,"['dkpol', 'sport', 'pride']",2021-08-20 22:01:23,kæmpe stort tillykke til kasper hjulmand med  årets laks   tak for din klare og utvetydige opbakning til kampen mod homofobi         ,5.0
Denmark - Copenhagen,958,0,['dkpol'],2021-08-20 22:01:07,sygeplejerskerne i odense og på fyn er fyldt med kampkraft og energi i den fortsatte strejke  ,-1.0
,49628,12,"['sindsyge', 'dkpol']",2021-08-20 21:57:58,er i blevet rablende gale  har kinavirus magten steget jer til hovedet   kommnuner skal ikke kunne sidde og bladre folks kontoudskrifter igennem  facister  ,-3.0
"Copenhagen, Denmark",2410,18,"['dkpol', 'dkgreen']",2021-08-20 21:56:41,    mio pattegrise døde i den danske svineindustri i       inden de blev en måned gamle  det er måske det allermest håndgribelige symbol på en syg industri  hvad er dit svar      ,-5.0
"Copenhagen, Denmark",227,7,['dkpol'],2021-08-20 21:52:52,ligesom vi savner en kulturminister med kærlighed for kunsten  så savner vi  i den grad  en uddannelses og forskningsminister med kærlighed for videnskaben ,6.0
,7612,4,['dkpol'],2021-08-20 21:52:47,weekendavisen   sagen mod morten messerschmidt bør gå om  via  dk  ,0.0
"Gladsaxe, Danmark",41249,0,['DKpol'],2021-08-20 21:50:32,joh   vi slap for trump    men vi har bare fået en anden gammel idiot    ,-3.0
Danmark,323459,2,['dkpol'],2021-08-20 21:50:04,messerschmidt klager over dommer   ,-2.0
Copenhagen,2792,2,['dkpol'],2021-08-20 21:49:34,messerschmidt klager over dommer   ,-2.0
"Aarhus, Denmark",4637,82,['dkpol'],2021-08-20 21:48:42, mir  var    år  jeg var     og det var mit ansvar at passe på ham når vi gik patruljer og når vi var i kamp  han havde ikke noget våben  så aftalen var  at han skulle blive lige bagved mig når kuglerne fløj   jeg kan ikke udtrykke hvor frustrerende og skamfuldt jeg har det ,1.0
,2610,0,['dkpol'],2021-08-20 21:45:17, indlysende politisk forskning  der er grænser for hvor mange gange man kan komme afsted med det uden det påvirker troværdigheden  der er ikke noget der antyder at udsigten til et midlertidig job afskrækker arbejdstagere fra at tage et job  alle job i dag er midlertidige  ,-1.0
Balochistan ~ Denmark  ,34788,4,"['dkmedier', 'dkpol']",2021-08-20 21:43:05,min seje veninde står frem og fortæller om sin far  som har været fanget i kabul  hun fortæller også hendes uimponerende oplevelse med udenrigsministeriet    i sidste ende måtte englænderne komme razmahs far til undsætning   ,-2.0
Danmark,14238,10,"['dkpol', 'COVID19dk', 'dkmedier']",2021-08-20 21:40:47,det er sjovt  som asymptomatisk smitte ikke længere er en ting  nu når det er de vaccinerede  som står for den     ,2.0
Danmark,323459,3,"['dkpol', 'dkmedier']",2021-08-20 21:40:03,nej det skal de under ingen omstændigheder  hvem har dog fundet på sådan en gang pjat       ,-1.0
Viborg / København,1407,3,"['dkpol', 'dkmedier']",2021-08-20 21:39:59,nej det skal de under ingen omstændigheder  hvem har dog fundet på sådan en gang pjat       ,-1.0
H.C. Andersen,2266,0,"['Kabul', 'Afghanistan', 'Taliban', 'dkpol']",2021-08-20 21:37:07,marinesoldater  der passer på afghanske børn i  lufthavn       ,0.0
"Frederiksberg, Denmark",45025,0,"['UgensKortFilm', 'dkmedier', 'Afghanistan', 'dkpol']",2021-08-20 21:34:46,  hver uge vælger jeg en film  blandt dem jeg har samlet som likes &amp; favorites over årene  ku du ha lyst til at vælge næste uges film  det må gerne være din egen; post en  gif og så kontakter jeg dig      ,2.0
Syddanmark,345034,51,['dkpol'],2021-08-20 21:33:44,danmark tvangsudsendte i juli udlændinge til afghanistan  mens taliban stormede frem   det oplyser myndighederne til ⁦⁩    tvangsudsendelse vil sige  at folk mod deres vilje og evt  med magt blev fløjet til afghanistan      ,2.0
Danmark,323459,2,['dkpol'],2021-08-20 21:33:03,selvfølgelig passer det ikke  hvad taliban har sagt om adgang til udlændinge til lufthavn  eller piger og kvinder kan fortsætte deres liv  en stor løgn så de kan få vesten ud og udvide deres fundamentaliske tyranni    ⁦⁩  ,-2.0
Danmark,1453,2,['dkpol'],2021-08-20 21:32:37,selvfølgelig passer det ikke  hvad taliban har sagt om adgang til udlændinge til lufthavn  eller piger og kvinder kan fortsætte deres liv  en stor løgn så de kan få vesten ud og udvide deres fundamentaliske tyranni    ⁦⁩  ,-2.0
København ,1172,4,"['dkmedier', 'dkpol']",2021-08-20 21:31:39,min seje veninde står frem og fortæller om sin far  som har været fanget i kabul  hun fortæller også hendes uimponerende oplevelse med udenrigsministeriet    i sidste ende måtte englænderne komme razmahs far til undsætning   ,-2.0
København,8123,51,['dkpol'],2021-08-20 21:31:05,danmark tvangsudsendte i juli udlændinge til afghanistan  mens taliban stormede frem   det oplyser myndighederne til ⁦⁩    tvangsudsendelse vil sige  at folk mod deres vilje og evt  med magt blev fløjet til afghanistan      ,2.0
København,8123,11,"['Afghanistan', 'dkpol']",2021-08-20 21:30:35,selvfølgelig kan og skal danmark tage imod flygtninge fra   mennesker  der flygter for livet  ,-2.0
,798,8,"['dkpol', 'Afghanistan', 'dkaid']",2021-08-20 21:29:47,ift  den her diskussion om  hvor dyrt det er at hjælpe afghanske flygtninge     det koster ca  ½ mia  at hjælpe        flygtninge  når man dummer sig i mellemøsten    det koster ca      mia  at hjælpe     minkavlere  når man dummer sig i herhjemme    ,11.0
,1869,13,"['dkmedier', 'dkpol', 'covid19dk']",2021-08-20 21:29:14,savner   syv  til bare at sige tingene som de er  statsministeren indrømmer i dag  at hun vidste  der ikke ville komme lyntest på plejehjem  selvom hun gav udtryk for  at de var på vej  men ingen i  tør kalde det hvad det er  bevidst vildledning   ,-3.0
"Aarhus, Danmark",159,4,"['dkpol', 'afghanistan']",2021-08-20 21:28:21,hvordan kan en forsvarschef holde en privat fest  på flyvevåbnets egne faciliteter  alt imens fly og jægersoldater var indsat i den måske mest omfattende og samtidig dårligst planlagte evakueringsoperation for forsvaret nogensinde      ,3.0
H.C. Andersen,2266,0,"['taliban', 'Kandahar', 'Afghanistan', 'dkpol']",2021-08-20 21:28:08,tak for gear  våben  fly og midler af militær kvalitet   med venlig hilsen det nye  sikkerhedsteam i  lufthavn     ,5.0
"A Copenhagen suburb, Europe",12322,4,"['dkpol', 'afghanistan']",2021-08-20 21:24:04,hvordan kan en forsvarschef holde en privat fest  på flyvevåbnets egne faciliteter  alt imens fly og jægersoldater var indsat i den måske mest omfattende og samtidig dårligst planlagte evakueringsoperation for forsvaret nogensinde      ,3.0
,1721,51,['dkpol'],2021-08-20 21:23:45,danmark tvangsudsendte i juli udlændinge til afghanistan  mens taliban stormede frem   det oplyser myndighederne til ⁦⁩    tvangsudsendelse vil sige  at folk mod deres vilje og evt  med magt blev fløjet til afghanistan      ,2.0
"Frederiksberg, Danmark",1846,0,"['søvejen', 'dkbiz', 'dkpol', 'eubiz', 'eupol', 'blaadk', 'kombardo']",2021-08-20 21:21:48,på øvejen kan man se den vitale skibstrafik  der holder forsyninger og mobilitet igang       ,0.0
,11,0,['dkpol'],2021-08-20 21:20:05,biden har virkelig begået en stor fejl i afghanistan  amerikanerne og med dem deres allierede har reelt set barrikaderet sig i lufthavnen omringet af taliban uden mulighed for at hjælpe alle dem  som skal ud af landet  ,3.0
Denmark,1122,0,"['stopdet', 'dkpol', 'dkmedier', 'sundpol', 'Covid19dk', 'coronadk', 'COVID19']",2021-08-20 21:18:09,fremtidssimulering af tiden efter den tyske regering går af  den er afholdt af corona investigative committee inklusiv dr  reiner fuellmich   videoen er med engelsk oversættelse         ,0.0
"Copenhagen, Denmark",1207,7,['dkpol'],2021-08-20 21:17:07,ligesom vi savner en kulturminister med kærlighed for kunsten  så savner vi  i den grad  en uddannelses og forskningsminister med kærlighed for videnskaben ,6.0
"Danmark, Europa",198692,4,"['dkpol', 'afghanistan']",2021-08-20 21:15:47,hvordan kan en forsvarschef holde en privat fest  på flyvevåbnets egne faciliteter  alt imens fly og jægersoldater var indsat i den måske mest omfattende og samtidig dårligst planlagte evakueringsoperation for forsvaret nogensinde      ,3.0
"Nordjylland, Danmark",182,25,"['stopdet', 'dkpol', 'dkmedier', 'sundpol', 'Covid19dk', 'coronadk', 'COVID19']",2021-08-20 21:10:40,det taler for sig selv         ,0.0
